[{"schema_version":"2.0.0","country_id":"guyana","slug":"guyana","status":"reviewed","page_kind":"country","last_reviewed":"2026-06-30","public_display_ceiling":"C","source_test_status":"partial","hero":{"summary_en":"The reviewed Act establishes legal context, but current-calendar output remains blocked.","summary_ja":"確認済み法律は制度文脈を示すが、現行カレンダー出力は停止する。"},"overview":{"paragraphs_en":["Guyana Horse Racing Authority legal context is the reviewed racing-system context.","No current official recurring meeting calendar or approved racecourse source is available."],"paragraphs_ja":["ガイアナ競馬当局法制度文脈を確認済み競馬体系文脈として扱う。","現行の公式定期開催カレンダーまたは承認済み競馬場ソースはない。"]},"racing_types":[{"id":"thoroughbred-flat","name_en":"Thoroughbred flat racing","name_ja":"サラブレッド平地競走","summary_en":"Represented by the reviewed Guyana Horse Racing Authority legal context.","summary_ja":"確認済みガイアナ競馬当局法制度文脈で扱う。"}],"seasonality":{"pattern":"official-source-required","summary_en":"Recheck the official source before each seasonal or calendar update.","summary_ja":"シーズンまたは日程更新ごとに公式ソースを再確認する。"},"schedule":{"timezone":"America/Guyana","utc_offset_label":"Verify current local offset","day_patterns":["official-source-required"],"time_patterns":["official-link-only"],"summary_en":"Current meeting rows are not approved; use the official link only.","summary_ja":"現行開催行は未承認で、公式リンクのみ案内する。"},"surfaces":{"ids":[],"summary_en":"Not normalized.","summary_ja":"共通化しない。"},"systems":[{"id":"guyana-legal-context","name_en":"Guyana Horse Racing Authority legal context","name_ja":"ガイアナ競馬当局法制度文脈","summary_en":"No current official recurring meeting calendar or approved racecourse source is available.","summary_ja":"現行の公式定期開催カレンダーまたは承認済み競馬場ソースはない。","organiser_source_ids":["guyana-racing-act"],"distributor_source_ids":[]}],"principal_racecourse_ids":[],"calendar_guidance_en":"Keep the page link-first and do not add current meeting rows.","calendar_guidance_ja":"リンク案内を中心とし、現行開催行を追加しない。","coverage_note_en":"No current official recurring meeting calendar or approved racecourse source is available.","coverage_note_ja":"現行の公式定期開催カレンダーまたは承認済み競馬場ソースはない。","revalidation":{"triggers_en":["The official route or calendar changes","Coverage expands beyond the reviewed system"],"triggers_ja":["公式導線または日程変更時","確認済み体系を超えて範囲拡張する時"]},"related_glossary_ids":["racecourse","meeting","fixture","post-time"]}]