[{"schema_version":"2.0.0","country_id":"mainland-china","slug":"mainland-china","status":"reviewed","page_kind":"country","last_reviewed":"2026-06-29","public_display_ceiling":"C","source_test_status":"partial","hero":{"summary_en":"Conghua's planned launch is confirmed, but current-calendar output remains blocked.","summary_ja":"従化競馬場の開業予定は確認済みだが、現行カレンダー出力は停止する。"},"overview":{"paragraphs_en":["The reviewed official HKJC source confirms a planned October 2026 launch at Conghua Racecourse.","A stable official meeting-date calendar has not yet been published."],"paragraphs_ja":["確認済みHKJC公式ソースで従化競馬場の2026年10月開業予定を確認できる。","安定した公式開催日カレンダーはまだ公開されていない。"]},"racing_types":[{"id":"thoroughbred-flat","name_en":"Flat racing","name_ja":"平地競走","summary_en":"Represented by the reviewed Conghua launch context.","summary_ja":"確認済み従化開業文脈で扱う。"}],"seasonality":{"pattern":"official-source-required","summary_en":"Recheck when an official Conghua meeting calendar is published.","summary_ja":"従化の公式開催カレンダー公開時に再確認する。"},"schedule":{"timezone":"Asia/Shanghai","utc_offset_label":"Verify current local offset","day_patterns":["official-source-required"],"time_patterns":["official-link-only"],"summary_en":"No current meeting fields are approved for public calendar output.","summary_ja":"公開カレンダー出力に使用できる現行開催項目は未承認。"},"surfaces":{"ids":[],"summary_en":"Not normalized.","summary_ja":"共通化しない。"},"systems":[{"id":"mainland-china-conghua-system","name_en":"Conghua Racecourse system","name_ja":"従化競馬場体系","summary_en":"Reviewed launch context without an approved meeting calendar.","summary_ja":"開催カレンダー未承認の確認済み開業文脈。","organiser_source_ids":["mainland-china-conghua-launch"],"distributor_source_ids":[]}],"principal_racecourse_ids":[],"calendar_guidance_en":"Do not create current meeting rows until an official date-addressable Conghua calendar is reviewed.","calendar_guidance_ja":"日付別の従化公式カレンダーを確認するまで現行開催行を作成しない。","coverage_note_en":"The reviewed scope is Conghua Racecourse only and does not establish wider Mainland China racing coverage.","coverage_note_ja":"確認済み範囲は従化競馬場のみで、中国本土全体の競馬網羅性は確立していない。","revalidation":{"triggers_en":["An official Conghua meeting calendar is published","The launch schedule changes","Wider official coverage is identified"],"triggers_ja":["従化公式開催カレンダー公開時","開業予定変更時","より広い公式網羅性確認時"]},"related_glossary_ids":["racecourse","meeting","fixture","post-time"]}]