[{"schema_version":"2.0.0","country_id":"azerbaijan","slug":"azerbaijan","status":"reviewed","page_kind":"special","last_reviewed":"2026-06-30","public_display_ceiling":"C","source_test_status":"partial","hero":{"summary_en":"The reviewed federation source confirms racing context, but no stable current meeting calendar is approved.","summary_ja":"確認済み連盟資料は競馬文脈を示すが、安定した現行開催日程は承認されていない。"},"overview":{"paragraphs_en":["Azerbaijan Equestrian Federation racing context is the reviewed racing-system context.","Racing remains separate from equestrian, show, polo, and chovqan activity, and no current meeting rows are approved."],"paragraphs_ja":["アゼルバイジャン馬術連盟競馬文脈を確認済み競馬体系文脈として扱う。","競馬は馬術、ショー、ポロ、チョフガンと分けて扱い、現行開催行は承認しない。"]},"racing_types":[{"id":"horse-racing","name_en":"Horse racing","name_ja":"競馬","summary_en":"Represented by the reviewed Azerbaijan Equestrian Federation racing context.","summary_ja":"確認済みアゼルバイジャン馬術連盟競馬文脈で扱う。"}],"seasonality":{"pattern":"official-source-required","summary_en":"Recheck the official source before each seasonal or calendar update.","summary_ja":"シーズンまたは日程更新ごとに公式ソースを再確認する。"},"schedule":{"timezone":"Asia/Baku","utc_offset_label":"Verify current local offset","day_patterns":["official-source-required"],"time_patterns":["official-link-only"],"summary_en":"Current meeting rows are not approved; use the official link only.","summary_ja":"現行開催行は未承認で、公式リンクのみ案内する。"},"surfaces":{"ids":[],"summary_en":"Not normalized.","summary_ja":"共通化しない。"},"systems":[{"id":"azerbaijan-racing-context","name_en":"Azerbaijan Equestrian Federation racing context","name_ja":"アゼルバイジャン馬術連盟競馬文脈","summary_en":"Racing remains separate from equestrian, show, polo, and chovqan activity, and no current meeting rows are approved.","summary_ja":"競馬は馬術、ショー、ポロ、チョフガンと分けて扱い、現行開催行は承認しない。","organiser_source_ids":["azerbaijan-araf-home"],"distributor_source_ids":[]}],"principal_racecourse_ids":[],"calendar_guidance_en":"Keep the page link-first and keep racing separate from other equestrian disciplines.","calendar_guidance_ja":"リンク案内を中心とし、競馬を他の馬術競技と分けて扱う。","coverage_note_en":"Federation activity does not establish a stable current racing calendar.","coverage_note_ja":"連盟活動は安定した現行競馬日程を示さない。","revalidation":{"triggers_en":["The official route or calendar changes","Coverage expands beyond the reviewed system"],"triggers_ja":["公式導線または日程変更時","確認済み体系を超えて範囲拡張する時"]},"related_glossary_ids":["racecourse","meeting","fixture","post-time"]}]
