[{"schema_version":"2.0.0","country_id":"united-kingdom","slug":"united-kingdom","status":"reviewed","page_kind":"country","last_reviewed":"2026-06-20","public_display_ceiling":"C","source_test_status":"complete","hero":{"summary_en":"The BHA national fixture list confirms meeting dates and racecourses; reusable national race times are not established.","summary_ja":"BHAの全国開催一覧で開催日と競馬場を確認済みだが、再利用可能な全国レース時刻は未確認。"},"overview":{"paragraphs_en":["The reviewed BHA fixture scope covers British flat and jump racing at calendar level."],"paragraphs_ja":["確認済みBHA開催範囲は、英国の平地競走と障害競走をカレンダーレベルで扱う。"]},"racing_types":[{"id":"thoroughbred-flat","name_en":"Thoroughbred flat racing","name_ja":"サラブレッド平地競走","summary_en":"Included in the reviewed BHA fixture list.","summary_ja":"確認済みBHA開催一覧に含まれる。"},{"id":"jump-racing","name_en":"Jump racing","name_ja":"障害競走","summary_en":"Included in the reviewed BHA fixture list.","summary_ja":"確認済みBHA開催一覧に含まれる。"}],"seasonality":{"pattern":"official-source-required","summary_en":"Use the current BHA fixture list for the active season.","summary_ja":"現行シーズンはBHA開催一覧で確認する。"},"schedule":{"timezone":"Europe/London","utc_offset_label":"Verify the current local UTC offset","day_patterns":["official-source-required"],"time_patterns":["meeting-date-only"],"summary_en":"Meeting dates and racecourses are confirmed; race times remain outside the reviewed country scope.","summary_ja":"開催日と競馬場は確認済みだが、レース時刻は国レベルの確認範囲外。"},"surfaces":{"ids":[],"summary_en":"Surface details are not normalized.","summary_ja":"馬場情報は共通化しない。"},"systems":[{"id":"united-kingdom-bha-system","name_en":"British Horseracing Authority fixtures","name_ja":"British Horseracing Authority開催体系","summary_en":"Reviewed national flat and jump fixture coverage at calendar level.","summary_ja":"全国の平地・障害開催をカレンダーレベルで確認済み。","organiser_source_ids":["united-kingdom-bha-home"],"distributor_source_ids":["united-kingdom-bha-fixtures"]}],"principal_racecourse_ids":[],"calendar_guidance_en":"Use the BHA fixture list and keep country output at meeting-date level.","calendar_guidance_ja":"BHA開催一覧を使用し、国ページ表示は開催日レベルに保つ。","coverage_note_en":"The reviewed scope does not establish every United Kingdom racing context or reusable race times.","coverage_note_ja":"確認済み範囲は英国の全競馬文脈や再利用可能なレース時刻を保証しない。","revalidation":{"triggers_en":["The BHA fixture route changes","A stable national race-time route is reviewed"],"triggers_ja":["BHA開催導線変更時","安定した全国レース時刻導線を確認したとき"]},"related_glossary_ids":["racecourse","meeting","fixture","post-time"]}]
