[
  {
    "schema_version": "2.0.0",
    "country_id": "bahrain",
    "slug": "bahrain",
    "status": "reviewed",
    "page_kind": "country",
    "last_reviewed": "2026-09-24",
    "public_display_ceiling": "A",
    "source_test_status": "complete",
    "hero": {
      "summary_en": "Bahrain racing is staged at the Rashid Equestrian & Horseracing Club, with official season programmes and date-specific racecards published by Bahrain Turf Club.",
      "summary_ja": "バーレーン競馬はRashid Equestrian & Horseracing Clubで開催され、Bahrain Turf Clubが公式シーズン番組と日付別レースカードを公開しています。"
    },
    "overview": {
      "paragraphs_en": [
        "Current official Bahrain Turf Club material confirms the Rashid Equestrian & Horseracing Club as Bahrain's sole horse-racing venue. The 2026/27 imported programme provides the season meeting dates, while date-specific racecards provide per-race post times when published."
      ],
      "paragraphs_ja": [
        "Bahrain Turf Clubの現行公式情報では、Rashid Equestrian & Horseracing Clubがバーレーン唯一の競馬開催会場と確認できます。2026/27シーズンの公式番組が開催日を示し、日付別レースカードは公開後に各レースの発走時刻を提供します。"
      ]
    },
    "racing_types": [
      {
        "id": "horse-racing",
        "name_en": "Horse racing",
        "name_ja": "競馬",
        "summary_en": "The reviewed racecard route confirms a current programme without a complete national code inventory.",
        "summary_ja": "レビュー済み導線で現行番組を確認していますが、全国の競走区分一覧は未確定です。"
      }
    ],
    "seasonality": {
      "pattern": "official-calendar-required",
      "summary_en": "Use the current Bahrain Turf Club calendar and racecard route.",
      "summary_ja": "Bahrain Turf Clubの現行日程とレースカード導線を確認します。"
    },
    "schedule": {
      "timezone": "Asia/Bahrain",
      "utc_offset_label": "UTC+3",
      "day_patterns": [
        "official-calendar-required"
      ],
      "time_patterns": [
        "published-by-official-source"
      ],
      "summary_en": "Post times must be taken from the selected official racecard.",
      "summary_ja": "発走時刻は対象の公式レースカードで確認します。"
    },
    "surfaces": {
      "ids": [],
      "summary_en": "Surface coverage is not assigned in this batch.",
      "summary_ja": "このbatchでは馬場種別を指定しません。"
    },
    "systems": [
      {
        "id": "bahrain-turf-club-system",
        "name_en": "Bahrain Turf Club system",
        "name_ja": "Bahrain Turf Club体系",
        "summary_en": "The club route and racecard route provide the reviewed public information.",
        "summary_ja": "クラブ導線とレースカード導線がレビュー済み公開情報を提供します。",
        "organiser_source_ids": [
          "bahrain-turf-club-home"
        ],
        "distributor_source_ids": [
          "bahrain-turf-club-racecards"
        ]
      }
    ],
    "principal_racecourse_ids": [
      "rashid-equestrian-and-horseracing-club-racecourse"
    ],
    "calendar_guidance_en": "Use the official Bahrain Turf Club season programme as the meeting-date mother set and the date-specific racecard for published per-race post times.",
    "calendar_guidance_ja": "Bahrain Turf Club公式シーズン番組を開催日の母集合として使い、レース別発走時刻は公開済みの日付別レースカードで確認してください。",
    "coverage_note_en": "The current Calendar route publishes verified meeting identity/date at C and promotes to A when complete official racecard post times are available. Rich racecard fields remain outside the publication boundary.",
    "coverage_note_ja": "現在のCalendar導線は、確認済み開催・日付をCで公開し、公式レースカードの全発走時刻が取得できるとAへ昇格します。その他の詳細なレースカード項目は公開対象外です。",
    "revalidation": {
      "triggers_en": [
        "The Bahrain Turf Club season programme route changes",
        "The Bahrain Turf Club racecard navigation changes",
        "The verified REHC venue identity or address changes"
      ],
      "triggers_ja": [
        "Bahrain Turf Clubシーズン番組導線が変更されたとき",
        "Bahrain Turf Clubレースカード導線が変更されたとき",
        "確認済みREHC会場情報または住所が変更されたとき"
      ]
    },
    "related_glossary_ids": [
      "racecourse",
      "meeting",
      "fixture",
      "post-time"
    ]
  }
]
