[
  {
    "schema_version": "2.0.0",
    "country_id": "lithuania",
    "slug": "lithuania",
    "status": "reviewed",
    "page_kind": "country",
    "last_reviewed": "2026-10-10",
    "public_display_ceiling": "C",
    "source_test_status": "complete",
    "hero": {
      "summary_en": "The official Ristūnų sportas Events API is automatically routed at rank C for source-visible Lithuanian trotting meetings with independently normalized venues.",
      "summary_ja": "Ristūnų sportas公式Events APIから、独立確認済み会場を持つリトアニア速歩競馬開催をCで自動取得する。"
    },
    "overview": {
      "paragraphs_en": [
        "The production scope is the Republican League of Racing Horses official event system.",
        "The Events API is GitHub-Actions-accessible; only source-visible events whose physical venue is independently normalized are published."
      ],
      "paragraphs_ja": [
        "production対象はRespublikinė lenktyninių žirgų lygaの公式イベント体系。",
        "Events APIはGitHub Actionsから取得可能で、物理会場を独立確認できたsource-visible eventのみ公開する。"
      ]
    },
    "racing_types": [
      {
        "id": "harness-racing",
        "name_en": "Harness racing",
        "name_ja": "ハーネス競走",
        "summary_en": "Represented by the reviewed Lithuanian Trotting Horse League calendar.",
        "summary_ja": "確認済みリトアニア速歩競馬リーグ日程体系で扱う。"
      }
    ],
    "seasonality": {
      "pattern": "official-source-required",
      "summary_en": "Recheck the official source before each seasonal or calendar update.",
      "summary_ja": "シーズンまたは日程更新ごとに公式ソースを再確認する。"
    },
    "schedule": {
      "timezone": "Europe/Vilnius",
      "utc_offset_label": "Verify DST-aware local offset",
      "day_patterns": [
        "official-events-api"
      ],
      "time_patterns": [
        "meeting-date-only"
      ],
      "summary_en": "Only reviewed meeting dates and venues may be used at rank C.",
      "summary_ja": "確認済み開催日と会場のみCで利用できる。"
    },
    "surfaces": {
      "ids": [],
      "summary_en": "Not normalized.",
      "summary_ja": "共通化しない。"
    },
    "systems": [
      {
        "id": "trotting-league-system",
        "name_en": "Lithuanian Trotting Horse League calendar",
        "name_ja": "リトアニア速歩競馬リーグ日程体系",
        "summary_en": "Automatic official Events API route for source-visible trotting meetings with normalized venues.",
        "summary_ja": "会場を正規化できたsource-visible速歩競馬開催を扱う公式Events API自動取得ルート。",
        "organiser_source_ids": [
          "trotting-league-events-api",
          "trotting-league-2026-calendar"
        ],
        "distributor_source_ids": []
      }
    ],
    "principal_racecourse_ids": [
      "lithuania--sirvintos-hipodromas"
    ],
    "calendar_guidance_en": "Use the official Events API and event-description venue evidence. Publish date and independently normalized venue only at rank C; reject unknown venue labels.",
    "calendar_guidance_ja": "公式Events APIとイベント本文の会場証拠を使用し、開催日と独立確認済み会場のみCで公開する。未知会場は推測しない。",
    "coverage_note_en": "Production automation covers source-visible league events whose venue is independently mapped; it does not claim every Lithuanian racing system or unpublished future meeting.",
    "coverage_note_ja": "production自動取得は独立マッピング済み会場を持つsource-visibleなリーグ開催を対象とし、リトアニア全競馬体系や未公開の将来開催は網羅主張しない。",
    "revalidation": {
      "triggers_en": [
        "Events API structure changes",
        "Event-description venue wording changes",
        "A new physical venue appears"
      ],
      "triggers_ja": [
        "Events API構造変更時",
        "イベント本文の会場表記変更時",
        "新しい物理会場が出現した時"
      ]
    },
    "related_glossary_ids": [
      "racecourse",
      "meeting",
      "fixture",
      "post-time"
    ]
  }
]
