[{"schema_version":"2.0.0","country_id":"slovenia","slug":"slovenia","status":"reviewed","page_kind":"country","last_reviewed":"2026-06-29","public_display_ceiling":"C","source_test_status":"partial","hero":{"summary_en":"The reviewed Slovenian trotting federation route remains link-only.","summary_ja":"確認済みのスロベニア速歩競馬連盟導線はリンク案内のみとする。"},"overview":{"paragraphs_en":["Kasaška zveza Slovenije is the reviewed official trotting federation.","A stable current-season meeting calendar has not been confirmed."],"paragraphs_ja":["Kasaška zveza Slovenijeを確認済み公式速歩競馬連盟として扱う。","安定した現行シーズン開催カレンダーは未確認。"]},"racing_types":[{"id":"harness-racing","name_en":"Harness racing","name_ja":"ハーネス競走","summary_en":"Represented by the reviewed national trotting federation context.","summary_ja":"確認済み全国速歩競馬連盟文脈で扱う。"}],"seasonality":{"pattern":"official-source-required","summary_en":"Recheck when the federation publishes a stable current-season calendar.","summary_ja":"連盟が安定した現行シーズンカレンダーを公開した時に再確認する。"},"schedule":{"timezone":"Europe/Ljubljana","utc_offset_label":"Verify current local offset","day_patterns":["official-source-required"],"time_patterns":["official-link-only"],"summary_en":"Current meeting dates are not approved for public calendar output.","summary_ja":"現行開催日は公開カレンダー出力に未承認。"},"surfaces":{"ids":[],"summary_en":"Not normalized.","summary_ja":"共通化しない。"},"systems":[{"id":"slovenia-trotting-system","name_en":"Slovenian trotting federation system","name_ja":"スロベニア速歩競馬連盟体系","summary_en":"Reviewed federation context without an approved current calendar.","summary_ja":"現行カレンダー未承認の確認済み連盟文脈。","organiser_source_ids":["slovenia-trotting-home"],"distributor_source_ids":[]}],"principal_racecourse_ids":[],"calendar_guidance_en":"Keep the page link-first and wait for a stable current calendar before adding meeting rows.","calendar_guidance_ja":"リンク案内を中心とし、安定した現行カレンダー確認後に開催行を追加する。","coverage_note_en":"The official federation is identified, while current calendar and racecourse coverage remain unconfirmed.","coverage_note_ja":"公式連盟は確認済みだが、現行カレンダーと競馬場の網羅性は未確認。","revalidation":{"triggers_en":["A stable current-season federation calendar is published","The official federation route changes"],"triggers_ja":["安定した現行シーズン連盟カレンダー公開時","公式連盟導線変更時"]},"related_glossary_ids":["racecourse","meeting","fixture","post-time"]}]