[{"schema_version":"2.0.0","country_id":"argentina","slug":"argentina","status":"reviewed","page_kind":"country","last_reviewed":"2026-06-20","public_display_ceiling":"C","source_test_status":"partial","hero":{"summary_en":"Palermo provides reviewed schedules; wider country coverage is incomplete.","summary_ja":"Palermoの日程は確認済みだが、全国網羅性は不完全。"},"overview":{"paragraphs_en":["The profile uses Palermo as a reviewed subsystem."],"paragraphs_ja":["プロフィールはPalermoを確認済み部分体系として使用する。"]},"racing_types":[{"id":"thoroughbred-flat","name_en":"Thoroughbred flat racing","name_ja":"サラブレッド平地競走","summary_en":"Verified in the Palermo subsystem.","summary_ja":"Palermo体系で確認済み。"}],"seasonality":{"pattern":"official-source-required","summary_en":"Use current reviewed sources.","summary_ja":"現行の確認済みソースを使用する。"},"schedule":{"timezone":"America/Argentina/Buenos_Aires","utc_offset_label":"Verify the current local UTC offset","day_patterns":["official-source-required"],"time_patterns":["meeting-date-only"],"summary_en":"The reviewed subsystem has detailed schedules, but country output remains at meeting-date level.","summary_ja":"確認済み部分体系は詳細日程に対応するが、国ページ表示は開催日レベルに保つ。"},"surfaces":{"ids":[],"summary_en":"Surface details are not normalized.","summary_ja":"馬場情報は共通化しない。"},"systems":[{"id":"argentina-palermo-system","name_en":"Hipódromo Argentino de Palermo","name_ja":"Hipódromo Argentino de Palermo","summary_en":"Reviewed racecourse subsystem; wider coverage remains incomplete.","summary_ja":"確認済み競馬場体系。広域網羅性は不完全。","organiser_source_ids":["argentina-palermo-calendar"],"distributor_source_ids":["argentina-palermo-schedules","argentina-buenos-aires-hipodromos"]}],"principal_racecourse_ids":[],"calendar_guidance_en":"Use Palermo for the reviewed scope and keep the country ceiling at C.","calendar_guidance_ja":"確認済み範囲ではPalermoを使用し、国上限をCに保つ。","coverage_note_en":"Additional racecourse systems require separate review.","coverage_note_ja":"追加の競馬場体系は別途確認が必要。","revalidation":{"triggers_en":["Palermo routes change","Additional systems are reviewed"],"triggers_ja":["Palermo導線変更時","追加体系を確認したとき"]},"related_glossary_ids":["racecourse","meeting","fixture","post-time"]}]
