[{"schema_version":"2.0.0","country_id":"philippines","slug":"philippines","status":"reviewed","page_kind":"country","last_reviewed":"2026-06-20","public_display_ceiling":"C","source_test_status":"complete","hero":{"summary_en":"PHILRACOM provides the reviewed national calendar; race times are not established.","summary_ja":"PHILRACOMの全国カレンダーを確認済みだが、レース時刻は未確認。"},"overview":{"paragraphs_en":["The profile uses the reviewed PHILRACOM calendar context."],"paragraphs_ja":["プロフィールは確認済みPHILRACOMカレンダー文脈を使用する。"]},"racing_types":[{"id":"thoroughbred-flat","name_en":"Thoroughbred flat racing","name_ja":"サラブレッド平地競走","summary_en":"Included in the reviewed calendar context.","summary_ja":"確認済みカレンダー文脈に含まれる。"}],"seasonality":{"pattern":"official-source-required","summary_en":"Use the current PHILRACOM calendar.","summary_ja":"現行PHILRACOMカレンダーを確認する。"},"schedule":{"timezone":"Asia/Manila","utc_offset_label":"UTC+8","day_patterns":["official-source-required"],"time_patterns":["meeting-date-only"],"summary_en":"Meeting dates are confirmed; race times remain outside the reviewed scope.","summary_ja":"開催日は確認済みだが、レース時刻は確認範囲外。"},"surfaces":{"ids":[],"summary_en":"Surface details are not normalized.","summary_ja":"馬場情報は共通化しない。"},"systems":[{"id":"philippines-philracom-system","name_en":"Philippine Racing Commission calendar","name_ja":"Philippine Racing Commissionカレンダー体系","summary_en":"Reviewed national calendar system.","summary_ja":"確認済み全国カレンダー体系。","organiser_source_ids":["philippines-philracom-home"],"distributor_source_ids":["philippines-philracom-calendar"]}],"principal_racecourse_ids":[],"calendar_guidance_en":"Use PHILRACOM and keep output at meeting-date level.","calendar_guidance_ja":"PHILRACOMを使用し、表示は開催日レベルに保つ。","coverage_note_en":"Venue details require separate reviewed records.","coverage_note_ja":"競馬場詳細は別の確認済みレコードが必要。","revalidation":{"triggers_en":["The PHILRACOM calendar changes","The source structure changes"],"triggers_ja":["PHILRACOMカレンダー変更時","ソース構造変更時"]},"related_glossary_ids":["racecourse","meeting","fixture","post-time"]}]
