[{"schema_version":"2.0.0","country_id":"lebanon","slug":"lebanon","status":"reviewed","page_kind":"country","last_reviewed":"2026-06-29","public_display_ceiling":"C","source_test_status":"partial","hero":{"summary_en":"The reviewed Lebanon authority context remains link-only without a current calendar.","summary_ja":"確認済みレバノン当局文脈は現行カレンダーがなくリンク案内のみとする。"},"overview":{"paragraphs_en":["The reviewed official member route identifies the Lebanon racing authority context.","A current 2026 meeting calendar is not available on the reviewed route."],"paragraphs_ja":["確認済み公式加盟団体導線でレバノン競馬当局の文脈を確認できる。","確認済み導線には現行2026年開催カレンダーがない。"]},"racing_types":[{"id":"thoroughbred-flat","name_en":"Flat racing","name_ja":"平地競走","summary_en":"Represented by the reviewed Beirut racing authority context.","summary_ja":"確認済みベイルート競馬当局文脈で扱う。"}],"seasonality":{"pattern":"official-source-required","summary_en":"Recheck when the official member route publishes a current calendar.","summary_ja":"公式加盟団体導線に現行カレンダーが公開された時に再確認する。"},"schedule":{"timezone":"Asia/Beirut","utc_offset_label":"Verify current local offset","day_patterns":["official-source-required"],"time_patterns":["official-link-only"],"summary_en":"No current meeting fields are approved for public calendar output.","summary_ja":"公開カレンダー出力に使用できる現行開催項目は未承認。"},"surfaces":{"ids":[],"summary_en":"Not normalized.","summary_ja":"共通化しない。"},"systems":[{"id":"lebanon-beirut-racing-system","name_en":"Beirut racing authority system","name_ja":"ベイルート競馬当局体系","summary_en":"Reviewed authority context without an approved current calendar.","summary_ja":"現行カレンダー未承認の確認済み当局文脈。","organiser_source_ids":["lebanon-ifahr-member"],"distributor_source_ids":[]}],"principal_racecourse_ids":[],"calendar_guidance_en":"Keep the page link-first and wait for a current official calendar before adding meeting rows.","calendar_guidance_ja":"リンク案内を中心とし、現行公式カレンダー確認後に開催行を追加する。","coverage_note_en":"Authority context is identified, while current meeting and wider national coverage remain unconfirmed.","coverage_note_ja":"当局文脈は確認済みだが、現行開催とより広い全国網羅性は未確認。","revalidation":{"triggers_en":["A current official calendar is published","The official member route changes"],"triggers_ja":["現行公式カレンダー公開時","公式加盟団体導線変更時"]},"related_glossary_ids":["racecourse","meeting","fixture","post-time"]}]