[{"schema_version":"2.0.0","country_id":"australia","slug":"australia","status":"reviewed","page_kind":"country","last_reviewed":"2026-06-20","public_display_ceiling":"C","source_test_status":"partial","hero":{"summary_en":"Racing Australia supports detailed Thoroughbred schedules, but wider state and racing-code coverage is incomplete.","summary_ja":"Racing Australiaは詳細なサラブレッド日程に対応するが、州・他競馬体系の網羅性は不完全。"},"overview":{"paragraphs_en":["The reviewed profile covers the national Thoroughbred service without claiming every Australian horse-racing code or state authority."],"paragraphs_ja":["確認済みプロフィールは全国サラブレッドサービスを扱うが、豪州の全競馬体系・州当局を網羅したとはしない。"]},"racing_types":[{"id":"thoroughbred-flat","name_en":"Thoroughbred flat racing","name_ja":"サラブレッド平地競走","summary_en":"Verified through Racing Australia.","summary_ja":"Racing Australiaで確認済み。"}],"seasonality":{"pattern":"official-source-required","summary_en":"Use current national and state official routes for active meetings.","summary_ja":"現行開催は全国・州の公式導線で確認する。"},"schedule":{"timezone":"multiple-timezones","utc_offset_label":"Verify the meeting timezone","day_patterns":["official-source-required"],"time_patterns":["meeting-date-only"],"summary_en":"The reviewed Thoroughbred subsystem supports race times, but country output remains at meeting-date level.","summary_ja":"確認済みサラブレッド体系ではレース時刻に対応するが、国ページ表示は開催日レベルに保つ。"},"surfaces":{"ids":[],"summary_en":"Surface details are not normalized.","summary_ja":"馬場情報は共通化しない。"},"systems":[{"id":"australia-racing-australia-thoroughbred","name_en":"Racing Australia Thoroughbred system","name_ja":"Racing Australiaサラブレッド体系","summary_en":"Reviewed national Thoroughbred service; state and additional racing-code coverage remains incomplete.","summary_ja":"全国サラブレッドサービスを確認済み。州・追加競馬体系の網羅性は不完全。","organiser_source_ids":["australia-racing-australia-home"],"distributor_source_ids":["australia-racing-australia-racebooks"]}],"principal_racecourse_ids":[],"calendar_guidance_en":"Use Racing Australia for the reviewed Thoroughbred subsystem and retain state and code distinctions.","calendar_guidance_ja":"確認済みサラブレッド体系はRacing Australiaを使用し、州・体系の区別を維持する。","coverage_note_en":"The reviewed scope is not a complete inventory of Australian horse-racing authorities or codes.","coverage_note_ja":"確認済み範囲は豪州の競馬当局・体系の完全一覧ではない。","revalidation":{"triggers_en":["Racing Australia routes change","State and additional code coverage is reviewed"],"triggers_ja":["Racing Australia導線変更時","州・追加体系を確認したとき"]},"related_glossary_ids":["racecourse","meeting","fixture","post-time"]}]
