[{"schema_version":"2.0.0","country_id":"singapore","slug":"singapore","status":"reviewed","page_kind":"archive","last_reviewed":"2026-06-30","public_display_ceiling":"C","source_test_status":"complete","hero":{"summary_en":"The official source confirms that Singapore Turf Club held its final race on October 5, 2024.","summary_ja":"公式資料はシンガポール・ターフクラブの最終開催が2024年10月5日だったと確認している。"},"overview":{"paragraphs_en":["Singapore Turf Club is treated as a closed domestic racing system.","The final-race date is archive context and not a current fixture."],"paragraphs_ja":["シンガポール・ターフクラブは終了した国内競馬体系として扱う。","最終開催日はアーカイブ文脈であり、現行開催ではない。"]},"racing_types":[{"id":"horse-racing","name_en":"Horse racing","name_ja":"競馬","summary_en":"Archive context for the former domestic system.","summary_ja":"旧国内競馬体系のアーカイブ文脈を扱う。"}],"seasonality":{"pattern":"archive-only","summary_en":"No current season is approved.","summary_ja":"現行シーズンは承認されていない。"},"schedule":{"timezone":"Asia/Singapore","utc_offset_label":"Verify current local offset","day_patterns":["archive-only"],"time_patterns":["official-link-only"],"summary_en":"No current meeting rows are approved.","summary_ja":"現行開催行は承認されていない。"},"surfaces":{"ids":[],"summary_en":"Historical details are not normalized.","summary_ja":"過去の詳細は共通化しない。"},"systems":[{"id":"singapore-turf-club-archive","name_en":"Singapore Turf Club archive","name_ja":"シンガポール・ターフクラブ・アーカイブ","summary_en":"The final race was held on October 5, 2024; no current calendar is approved.","summary_ja":"最終開催は2024年10月5日で、現行日程は承認しない。","organiser_source_ids":["singapore-tote-board-archive"],"distributor_source_ids":[]}],"principal_racecourse_ids":[],"calendar_guidance_en":"Keep the page archive-only and exclude Singapore from current-calendar listings.","calendar_guidance_ja":"アーカイブ専用とし、シンガポールを現行日程一覧から除外する。","coverage_note_en":"The final-race date must not generate a current meeting row.","coverage_note_ja":"最終開催日から現行開催行を生成しない。","revalidation":{"triggers_en":["An official new domestic racing system is announced"],"triggers_ja":["新たな国内競馬体系が公式発表された時"]},"related_glossary_ids":["racecourse","meeting","fixture"]}]
