[{"schema_version":"2.0.0","country_id":"libya","slug":"libya","status":"reviewed","page_kind":"country","last_reviewed":"2026-06-29","public_display_ceiling":"C","source_test_status":"partial","hero":{"summary_en":"The reviewed Libyan racing route remains link-only without a current upcoming calendar.","summary_ja":"確認済みリビア競馬導線は現行予定カレンダーがなくリンク案内のみとする。"},"overview":{"paragraphs_en":["The reviewed official route identifies the Libyan national racing authority context.","A current 2026 upcoming meeting calendar has not been confirmed."],"paragraphs_ja":["確認済み公式導線でリビア全国競馬当局の文脈を確認できる。","現行2026年予定開催カレンダーは未確認。"]},"racing_types":[{"id":"thoroughbred-flat","name_en":"Flat racing","name_ja":"平地競走","summary_en":"Represented by the reviewed national authority context.","summary_ja":"確認済み全国当局文脈で扱う。"}],"seasonality":{"pattern":"official-source-required","summary_en":"Recheck when a stable current public calendar is published.","summary_ja":"安定した現行公開カレンダーが公開された時に再確認する。"},"schedule":{"timezone":"Africa/Tripoli","utc_offset_label":"Verify current local offset","day_patterns":["official-source-required"],"time_patterns":["official-link-only"],"summary_en":"No current meeting date or venue pairing is approved for public calendar output.","summary_ja":"公開カレンダー出力に使用できる現行開催日・会場の組み合わせは未承認。"},"surfaces":{"ids":[],"summary_en":"Not normalized.","summary_ja":"共通化しない。"},"systems":[{"id":"libya-national-racing-system","name_en":"Libyan national racing system","name_ja":"リビア全国競馬体系","summary_en":"Reviewed authority context without an approved current calendar.","summary_ja":"現行カレンダー未承認の確認済み当局文脈。","organiser_source_ids":["libya-official-racing"],"distributor_source_ids":[]}],"principal_racecourse_ids":[],"calendar_guidance_en":"Keep the page link-first and wait for a stable current calendar before adding meeting rows.","calendar_guidance_ja":"リンク案内を中心とし、安定した現行カレンダー確認後に開催行を追加する。","coverage_note_en":"The authority context is reviewed, while current meetings and complete national venue coverage remain unconfirmed.","coverage_note_ja":"当局文脈は確認済みだが、現行開催と全国会場網羅性は未確認。","revalidation":{"triggers_en":["A stable current calendar is published","The official racing route changes"],"triggers_ja":["安定した現行カレンダー公開時","公式競馬導線変更時"]},"related_glossary_ids":["racecourse","meeting","fixture","post-time"]}]