[
  {
    "schema_version": "2.0.0",
    "country_id": "kenya",
    "slug": "kenya",
    "status": "reviewed",
    "page_kind": "country",
    "last_reviewed": "2026-10-09",
    "public_display_ceiling": "C",
    "source_test_status": "complete",
    "hero": {
      "summary_en": "The Jockey Club of Kenya 2026-2027 season calendar is automatically routed at rank C for Ngong Racecourse.",
      "summary_ja": "Jockey Club of Kenyaの2026-2027シーズン日程をNgong RacecourseについてCで自動取得する。"
    },
    "overview": {
      "paragraphs_en": [
        "The production scope is the Jockey Club of Kenya and Ngong Racecourse.",
        "The official Upcoming Race Dates page is GitHub-Actions-accessible and exposes the current 2026-2027 season meeting dates."
      ],
      "paragraphs_ja": [
        "production対象はJockey Club of KenyaとNgong Racecourseに限定する。",
        "公式Upcoming Race DatesページはGitHub Actionsから取得でき、現行2026-2027シーズンの開催日を確認できる。"
      ]
    },
    "racing_types": [
      {
        "id": "thoroughbred-flat",
        "name_en": "Flat racing",
        "name_ja": "平地競走",
        "summary_en": "Reviewed for Ngong Racecourse.",
        "summary_ja": "Ngong Racecourseで確認済み。"
      }
    ],
    "seasonality": {
      "pattern": "official-source-required",
      "summary_en": "Check the current and next-season official date list.",
      "summary_ja": "現行・次シーズンの公式開催日一覧を確認する。"
    },
    "schedule": {
      "timezone": "Africa/Nairobi",
      "utc_offset_label": "UTC+3",
      "day_patterns": [
        "official-season-calendar"
      ],
      "time_patterns": [
        "meeting-date-only"
      ],
      "summary_en": "Meeting dates and venue are confirmed; reusable race times are not.",
      "summary_ja": "開催日と会場は確認済みだが、再利用可能なレース時刻は未確認。"
    },
    "surfaces": {
      "ids": [],
      "summary_en": "Not normalized.",
      "summary_ja": "共通化しない。"
    },
    "systems": [
      {
        "id": "ngong-jck-racing-system",
        "name_en": "Jockey Club of Kenya / Ngong calendar",
        "name_ja": "Jockey Club of Kenya・Ngongカレンダー",
        "summary_en": "Automatic single-racecourse JCK seasonal calendar route for Ngong Racecourse.",
        "summary_ja": "Ngong Racecourseを対象とするJCK季節日程の自動取得ルート。",
        "organiser_source_ids": [
          "jck-upcoming-race-dates"
        ],
        "distributor_source_ids": []
      }
    ],
    "principal_racecourse_ids": [
      "kenya--ngong-racecourse"
    ],
    "calendar_guidance_en": "Use the official JCK 2026-2027 seasonal date list and publish meeting date plus Ngong Racecourse only at rank C.",
    "calendar_guidance_ja": "JCK公式2026-2027シーズン日程を使用し、開催日とNgong RacecourseのみをCで公開する。",
    "coverage_note_en": "Automatic production coverage is C for the reviewed JCK / Ngong system; race post times remain outside the approved scope.",
    "coverage_note_ja": "production自動取得はJCK / Ngong体系のC。発走時刻は承認範囲外。",
    "revalidation": {
      "triggers_en": [
        "Season rollover",
        "Upcoming Race Dates structure changes",
        "Ngong venue context changes"
      ],
      "triggers_ja": [
        "シーズン切替時",
        "Upcoming Race Dates構造変更時",
        "Ngong会場文脈変更時"
      ]
    },
    "related_glossary_ids": [
      "racecourse",
      "meeting",
      "fixture",
      "post-time"
    ]
  }
]
